,Titre,DOI,Auteurs,Date de publication,Abstract,Lien fichier,Type fichier
39,Microstructural dependence of the fracture toughness of metallic thin films: A bulge test and atomistic simulation study on single-crystalline and polycrystalline silver films,10.1557/jmr.2019.262,"Preiß, Eva I., Hao, Lyu, Liebig, Jan P., Richter, Gunther, Gannott, Florentina, Gruber, Patric A., Göken, Mathias, Bitzek, Erik, Merle, Benoit",2019-10-28,"The microstructure contribution to the very low fracture toughness of freestanding metallic thin films was investigated by bulge fracture tests on 200-nm-thick {100} single-crystalline and polycrystalline silver films. The single-crystalline films exhibited a significantly lower fracture toughness value (KIC= 0.88 MPa m1/2) than their polycrystalline counterparts (KIC= 1.45 MPa m1/2), which was rationalized by the observation of an unusual crack initiation behavior—characterized by twinning in front of the notch tip—during in situ testing in the atomic force microscope. Twinning was also observed as a dominant deformation mechanism in atomistic simulations. This twinning tendency is explained by comparing the resolved shear stresses acting on the leading partial dislocation and the full dislocation, which allows to develop a size- and orientation-dependent twinning criterion. The fracture toughness of polycrystalline samples was found to be higher because of the energy dissipation associated with full dislocation plasticity and because of crack meandering along grain boundaries.",https://zenodo.org/api/files/52737802-7ff8-45ad-8689-1cbc94b70315/Preiss_Ha0_Bitzek_Merle_Ag_crack_jmr2019.pdf,pdf
40,Photocatalytic Degradation of Organic Pollutant Reacting with Tungstates: Role of Microstructure and Size Effect on Oxidation Kinetics,10.5281/zenodo.1109063,"A. Taoufyq, B. Bakiz, A. Benlhachemi, L. Patout, D. V. Chokouadeua, F. Guinneton, G. Nolibe, A. Lyoussi, J-R. Gavarri",2015-09-01,"The aim of this study was to investigate the
photocatalytic activity of polycrystalline phases of bismuth tungstate
of formula Bi2WO6. Polycrystalline samples were elaborated using a
coprecipitation technique followed by a calcination process at
different temperatures (300, 400, 600 and 900°C). The obtained
polycrystalline phases have been characterized by X-ray diffraction
(XRD), scanning electron microscopy (SEM), and transmission
electron microscopy (TEM). Crystal cell parameters and cell volume
depend on elaboration temperature. High-resolution electron
microscopy images and image simulations, associated with X-ray
diffraction data, allowed confirming the lattices and space groups
Pca21. The photocatalytic activity of the as-prepared samples was
studied by irradiating aqueous solutions of Rhodamine B, associated
with Bi2WO6 additives having variable crystallite sizes. The
photocatalytic activity of such bismuth tungstates increased as the
crystallite sizes decreased. The high specific area of the
photocatalytic particles obtained at 300°C seems to condition the
degradation kinetics of RhB.",https://zenodo.org/api/files/ae8c0578-2382-4e51-b3d3-ebbc32098f71/10002494.pdf,pdf
41,"Data from: Arsenic bioaccumulation in subarctic fishes of a mine-impacted bay on Great Slave Lake, Northwest Territories, Canada",10.5061/dryad.c2q52rs,"Chételat, John, Cott, Peter A., Rosabal, Maikel, Houben, Adam, McClelland, Christine, Belle Rose, Elise, Amyot, Marc",2019-09-11,"A subarctic fish community in mine-impacted Yellowknife Bay (Great Slave Lake, Northwest Territories, Canada) was investigated for biological and ecological processes controlling arsenic bioaccumulation. Total concentrations of arsenic, antimony, and metals were measured in over 400 fishes representing 13 species, and primary producers and consumers were included to characterize food web transfer. Yellowknife Bay had slightly more arsenic in surface waters (~3 µg/L) relative to the main body of Great Slave Lake (<1 µg/L), resulting in two-fold higher total arsenic concentrations in muscle of burbot (Lota lota), lake whitefish (Coregonus clupeaformis), and northern pike (Esox lucius). Other mining-associated contaminants, specifically antimony, lead, and silver, were typically below analytical detection in those fish species. No evidence was found for enhanced bioaccumulation of arsenic in long-lived, slow-growing subarctic fishes. Food web biodilution of total arsenic occurred between primary producers, aquatic invertebrates, and fish, although trophic position did not explain arsenic concentrations among fishes. Pelagic-feeding species had higher total arsenic concentrations compared to littoral fishes. Arsenic accumulated in subarctic fishes to comparable levels as fishes from lakes around the world with similar water arsenic concentrations. This first comprehensive study for a subarctic freshwater food web identified the importance of water exposure, biodilution, and habitat-specific feeding on arsenic bioaccumulation.",https://zenodo.org/api/files/a8e81af4-58bc-4c07-a4e0-9932e8bb2293/Dryad%20Dataset_PLOS%20ONE_Great%20Slave%20Lake%20Fish%20Metal%28loid%29s_June%202019.xlsx,xlsx
42,Microbial interactions impact the growth response of Clostridioides difficile to antibiotics,10.5281/zenodo.7049039,"Hromada, Susan, Venturelli, Ophelia S",2022-09-05,"In the human gut, the growth of Clostridioides difficile is impacted by a complex web of inter-species interactions with members of human gut microbiota. We investigate the contribution of inter-species interactions on the antibiotic response of C. difficile to clinically relevant antibiotics using bottom-up assembly of human gut communities. We discover two classes of microbial interactions that alter C. difficile’s antibiotic susceptibility: infrequent increases in tolerance at high antibiotic concentrations and frequent growth enhancements at low antibiotic concentrations. Based on genome-wide transcriptional profiling data, we demonstrate that metal sequestration due to hydrogen sulfide production by the prevalent gut species Desulfovibrio piger increases metronidazole tolerance of C. difficile. Competition with species that display higher sensitivity to the antibiotic than C. difficile leads to enhanced growth of C. difficile at low antibiotic concentrations. A dynamic computational model identifies the ecological design principles driving this effect. Our results provide a deeper understanding of ecological and molecular principles shaping C. difficile’s response to antibiotics, which could inform therapeutic interventions.",https://zenodo.org/api/files/8c8d2a85-9942-4e5c-b224-655450baff3d/Abundance_data_Fig2A_SuppFig1.xlsx,xlsx
43,Methods of dislocation structure characterization in AIIIBV semiconductor single crystals,10.3897/j.moem.8.4.99385,"Knyazev, Stanislav N., Kudrya, Aleksandr V., Komarovskiy, Nikita Yu., Parkhomenko, Yuri N., Molodtsova, Elena V., Yushchuk, Vyacheslav V.",2022-12-19,"The development pace of advanced electronics raises the demand for semiconductor single crystals and strengthens the requirements to their structural perfection. Dislocation density and distribution pattern are most important parameters of semiconductor single crystals which determine their performance as integrated circuit components. Therefore studies of the mechanisms of dislocation nucleation, slip and distribution are among the most important tasks which make researchers face the choice of suitable analytical methods. This work is an overview of advanced methods of studying and evaluating dislocation density in single crystals. Brief insight has been given on the main advantages and drawbacks of the methods overviewed and experimental data have been presented. The selective etching method (optical light microscopy) has become the most widely used one and in its conventional setup is quite efficient in the identification of scrap defects and in dislocation density evaluation by number of etch pits per vision area. Since the introduction of digital light microscopy and the related transfer from image analysis to pixel intensity matrices and measurement automation, it has become possible to implement quantitative characterization for the entire cross-section of single crystal wafers and analyze structural imperfection distribution pattern. X-ray diffraction is conventionally used for determination of crystallographic orientation but it also allows evaluating dislocation density by rocking curve broadening in double-crystal setup. Secondary electron scanning electron microscopy and atomic force microscopy allow differentiating etch patterns by origin and studying their geometry in detail. Transmission electron microscopy and induced current method allow obtaining micrographs of discrete dislocations but require labor-consuming preparation of experimental specimens. X-ray topography allows measuring bulky samples and also has high resolution but is hardly suitable for industry-wide application due to the high power consumption of measurements. Digital image processing broadens the applicability range of basic dislocation structure analytical methods in materials science and increases the authenticity of experimental results.",https://zenodo.org/api/files/613928c4-dba7-4b97-bed5-8a07a01d4d13/MoEM_article_99385.pdf,pdf
44,DETERMINATION DE LA RESISTANCE SERIE DE LA PHOTOPILE AU SILICIUM (N+/P/P+) A JONCTIONS VERTICALES SERIES SOUS CHAMP MAGNETIQUE,10.5281/zenodo.5763072,"Gora DIOP , Mame Faty Mbaye FALL , Mamadou SALL, Khady LOUM , Ibrahima DIATTA , Mor NDIAYE, Mamadou WADE and Gregoire SISSOKO",2021-10-19,"Lequation de magneto transport relative aux porteurs minoritaires de charge dans la base de la photopile au silicium a jonctions verticales series, est resolue, munie des conditions aux limites, definies par les vitesses de recombinaison a la jonction et en face arriere. Le photocourant et la phototension sont determines, et representes par la caracteristique courant-tension (Iph(Sf)-Vph(Sf)) de la photopile sous eclairement monochromatique. Le modele electrique equivalent de la photopile en situation de circuit ouvert, conduit a la determination de la resistance serie, pour differentes epaisseurs optimum de la base, imposees par le champ magnetique applique.
 ",https://zenodo.org/api/files/893aa0a1-1c27-4ad4-8cc4-db3611d8e868/48.pdf,pdf
45,ISO Certification of structural steel products,10.5281/zenodo.3462319,"Vogiatzis, Tzanetis",2012-04-15,"Η Ευρωπαϊκή Επιτροπή για θέματα Επιχειρήσεων και Βιομηχανίας εισάγει με την οδηγία 89/106/EEC κατευθυντήριες
οδηγίες των προδιαγραφούν που θα πρέπει να πληρούν τα δομικά προϊόντα. Σκοπός αυτής της οδηγίας είναι να εξασφαλίσει την ελεύθερη διακίνηση των δομικών προϊόντων μέσα στην Ευρωπαϊκή Ένωση εναρμονίζοντας τις σχετικές νομοθεσίες της κάθε χώρας ως προς τις θεμελιώδης απαιτήσεις Υγείας και Ασφάλειας των προϊόντων. Στην Ελλάδα ψηφίστηκε στις 15/06/2012 το ΦΕΚ 1914/Β/2012 θέτοντας έτσι ένα νόμο πάνω στα προϊόντα Δομικών Κατασκευών ο οποίος συμπεριλαμβάνει χαρακτηριστικά, τεχνικές προδιαγραφές, διαδικασίες αξιολόγησης συμμόρφωσης και σήμανση συμμόρφωσης CE.",https://zenodo.org/api/files/83bf15f5-7ae5-433e-b1af-8aff87151bdf/2012MC-I2_Vogiatzis_Tzanetis.pdf,pdf
46,Composite Steel Plate Shear Walls,10.5281/zenodo.3462131,"Anastasiadis, Anthimos, Vogiatzis, Tzanetis",2009-07-15,"Στην Ελλάδα, τα δομικά συστήματα μεταλλικών-σύμμικτων τοιχωμάτων τα έχουμε γνωρίσει, κυρίως, σε εφαρμογές ενισχύσεων κατασκευών οπλισμένου σκυροδέματος. Ωστόσο, όταν αυτά εντάσσονται σε μεταλλικά πλαίσια δημιουργούν ένα νέο δομοστατικό μικτό σύστημα πλαίσιο-τοίχωμα (μεταλλικό ή σύμμικτο) κατ’ αντιστοιχία με τα ομοειδή συστήματα από οπλισμένο σκυρόδεμα. Ουσιαστικά, η εμφάτνωση του μεταλλικού ή σύμμικτου τοιχείου εντός του μεταλλικού πλαισίου δημιουργεί ένα φέροντα οργανισμό ο οποίος συνδυάζει τα πλεονεκτήματα των δύο ανεξάρτητων συστημάτων και αλληλοαναιρεί τα μειονεκτήματα αυτών. Γενικά, η προσθήκη του τοιχώματος παρέχει υψηλή δυσκαμψία στο σύστημα μειώνοντας την μετακίνηση του φορέα, αυξημένη υπερστατικότητα, αντοχή και πλαστιμότητα αναπτύσσοντας τις κατάλληλες συνθήκες για την αποφυγή μηχανισμού ορόφου (μαλακού ορόφου) ή συνολικής κατάρρευσης του φορέα. Τα μεταλλικά τοιχεία ως δομοστατικό σύστημα ικανοποιούν τις βασικές απαιτήσεις του αντισεισμικού σχεδιασμού εξασφαλίζοντας δυσκαμψία-αντοχή-πλαστιμότητα, ενώ παράλληλα ανάλογα με την μόρφωση του συστήματος είναι δυνατό να επιτευχθεί αυξημένη ενεργειακή απόσβεση της εισαγόμενης ενέργειας (π.χ. χρήση χάλυβα χαμηλής διαρροής 80-230 MPa, σύστημα τοιχείου αποσβεστήρα).",https://zenodo.org/api/files/85bee1e2-1e07-45a1-9669-2cafda8614cd/2009MC-I3_Anastasiadis_Vogiatzis.pdf,pdf
47,High-rise buildings,10.5281/zenodo.3462307,"Vogiatzis, Tzanetis",2011-04-15,"Η κατασκευή των ουρανοξυστών παραδοσιακά έχει συνδεθεί με την ευρωστία και την οικονομική άνθηση των χωρών στις οποίες κατασκευάζονται αλλά παράλληλα επιδεικνύουν και τα τελευταία επιτεύγματα στο χώρο της αρχιτεκτονικής, της μηχανικής καθώς και των ηλεκτρομηχανολογικών εγκαταστάσεων. Η κατασκευή του πολυθρύλητου Barj-Khalifa Dubai ξεπέρασε κάθε κατασκευαστικό όριο φθάνοντας σε ένα ύψος πέρα των 800. Αξίζει να δούμε την ιστορική εξέλιξη όπως αυτή καταγράφεται από το CTBUH. Παρατηρούμε ότι χρειάζονται περίπου 40 χρόνια προκειμένου να εισάγουμε νέες τεχνικές μελέτης και κατασκευής έτσι ώστε να ξεπεράσουμε το προηγούμενο επίτευγμα. Ουσιαστικά μια «επαγγελματική γενιά» θέτει τις βάσεις ανάπτυξης η επόμενη εφαρμόζει και από την συσσωρευθήσα εμπειρία σε κάποια στιγμή η αλληλεπίδραση των γενεών επέφερε την κατασκευή ενός πύργου
ορόσημο του Burj-Khalifa Dubai. Ορόσημα αποτέλεσαν η ανέγερση του Empire State Building (1931, New York), του
World Trade Center (1972, New York) και του προαναφερθέντος Burj Dubai.Το σύνολο των στοιχείων της εργασίας έχουν ληφθεί από τον ιστοχώρο του φορέα που ασχολείται με την ανάπτυξη και τον σχεδιασμό ψηλών κτιρίων, υπό την ονομασία Council on Tall Buildings and Urban Habitat, CTBUH, με έδρα το Σικάγο των Η.Π.Α. και παραρτήματα σε όλες τις Ηπείρους.",https://zenodo.org/api/files/1bb8cf0d-f843-4adb-88a5-553a7df07119/2011MC-I1_Vogiatzis_Tzanetis.pdf,pdf
48,"(CUALSE2)1-X (TASE)X ALLOY SYSTEM (0 ≤ X ≤ 0.5): X-RAY DIFFRACTION, DIFFERENTIAL THERMAL ANALYSIS AND SCANNING ELECTRON MICROSCOPY  MEASUREMENTS",10.5281/zenodo.7397075,"Grima-Gallardo, Pedro, Muñoz, Marcos, Durán, Sonia, Delgado, Gerzon, Pérez-Cappé, Eduardo, Aitken, Jennifer, Rai, Dibya",2021-03-11,"Polycrystalline samples belonging to the (CuAlSe2)1-x(TaSe)x alloys system, in the composition interval 0 ≤ x ≤ 0.5, were synthesized by the melt and anneal method. X-Ray Diffraction (XRD), Scanning Electron Microscopy (SEM), and Differential Thermal Analysis (DTA) techniques were used for the characterization of the products. From XRD it can be observed a chalcopyrite-like single phase in the composition range 0 ≤ x ≤ 0.1, with lattice parameters very close to CuAlSe2 and two-phases, chalcopyrite-like and hexagonal-Cu0.52TaSe2, for 0.1 < x ≤ 0.5. By SEM, the stoichiometry for all samples had been measured and the new phase was identified as (Cu0.4Al0.3)TaSe2. From DTA the respective phase transitions with temperature were obtained. Using the experimental information, a preliminary T-x phase diagram was proposed.",https://zenodo.org/api/files/38c0d308-a52f-4c26-8259-c17d962a8aab/1071%283%29%2034%20-49.pdf,pdf
49,HYDROXYAPATITE INFLUENCE ON THE THERMAL AND MECHANICAL PROPERTIES OF A HIGHLY POROUS BONE CEMENT,10.5281/zenodo.7397045,"Montaño, Carlos, Lemos, Bruno, Yoshida, Maria, Almeida, Natanael, Campos, Tarcísio",2021-02-16,"Background: Bone cements based on acrylics have been used in different orthopedic procedures. Currently, the PMMA+HAp system is used as bone cement in a minimally invasive procedure known as Vertebroplasty. In this paper, the main goal was to study the Hydroxyapatite influence on the thermal and mechanical properties of a non-commercial bone cement. The relationship of the glass transition Tg with its mechanical properties of the samples was also investigated. Materials and Methods: The bone cement as (1-x)PMMA-xHAp binary system was prepared in six distinct concentrations, such that [x] parameter is the concentration varying from 0.0 up to 0.5. The Hydroxyapatite (HAp) was synthesized using a sol-gel procedure following calcination by thermal treatment. The composite was prepared by mixing Polymethylmethacrylate (PMMA) and HAp. Differential scanning calorimetry (DSC),  hermogravimetric analysis (TGA) and mechanical compressive strength (CS) were used to study the thermal and mechanical properties. The DSC and TGA thermal profiles as a function to concentration [x] were presented. Results:  he concentration at x = 0.5 or x5 exhibited mechanical behavior similar to porous tissues compared with bone. The CS lies in a range of 1.71 - 7.37 MPa and the glass transition temperature Tg = 102.57 °C. Conclusions:  here are direct relationships between the thermoplastic features of the PMMA+HAp system and its mechanical and thermal properties as a function of the biophosphonate concentrations ratio.",https://zenodo.org/api/files/c1ff917b-04c3-4202-a327-edac803ae6bd/1043%282%29%2021-33.pdf,pdf
50,Structural detailing in steel buildings,10.5281/zenodo.3462173,"Vogiatzis, Tzanetis",2009-10-15,"Τα έργα από δομικό χάλυβα απαιτούν γνώση και εξειδίκευση πέρα από την καθαρά υπολογιστική ικανότητα του μηχανικού μελετητή. Είναι τέτοια η φύση των έργων, ακόμη και των πιο απλών, που δημιουργούν την ανάγκη για την ανάπτυξη μιας σειράς σχεδίων προκειμένου να καταστεί εφικτή η ανέγερση της κατασκευής. Πέρα όλων των άλλων ο μελετητής μεταλλικών κατασκευών πρέπει να γνωρίζει μια σειρά από κατασκευαστικές πρακτικές προκειμένου να εκπονήσει μια άρτια μελέτη κατασκευάσιμη στο σύνολο της. Επίσης πρέπει να γνωρίζει την διαθεσιμότητα της αγοράς σε υλικά (π.χ. διατομές που υπάρχουν στην αγορά), τις δυνατότητες του κατασκευαστικού τομέα επεξεργασίας μεταλλικών κατασκευών και τέλος τις εκάστοτε συνθήκες κατά τις οποίες θα ανεγερθεί η κατασκευή. Ερωτήματα του τύπου “κοχλιωτές ή συγκολλητές συνδέσεις”, “χρήση πρότυπων ή συγκολλητών διατομών, “συνδέσεις απλής διάτμησης ή κάμψης” υφίστανται στην καθημερινή πρακτική του μελετητή. Η απάντηση δεν είναι πάντα εύκολη και απαιτεί συνδυασμό πολλών παραγόντων προκειμένου να επιτευχθεί η βέλτιστη λύση.",https://zenodo.org/api/files/79104464-3feb-4c72-8c7e-298b99542b43/2009MC-I4_Vogiatzis_Tzanetis.pdf,pdf
51,ESTUDIO ESTRUCTURAL Y DIAGRAMA DE FASES DEL SISTEMA DE ALEACIONES Cu2Zn1-zMnzSnSe,10.5281/zenodo.7397089,"Moreno, Ekadink, Quintero, Miguel, Villarreal, Manuel, Quintero, Eugenio, Morocoima, Manuel, Delgado, Gerzon, Contreras,Jines, Chourio, Myriam",2022-04-30,"Se reporta el estudio estructural y el diagrama de fases del sistema de aleaciones Cu2Zn1-zMnzSnSe4. Las muestras policristalinas se sintetizaron utilizando la técnica de fusión directa y recocido a partir de los elementos constituyentes. El análisis por difracción de rayos-X indica que el sistema cristaliza en la estructura tetragonal estannita con grupo espacial I42m. A partir de los puntos experimentales del análisis térmico diferencial (ATD) se construyó el diagrama de fases del sistema, el cual sugiere que la región entre 600 y 700 ºC es bifásica coexistiendo las fases estannita y wurtz-estannita (α+β). La descomposición peritéctica del sistema  δ→(L+ZnSe) en la región entre z = 0 y z ~ 0,80 ocurre ~ 800 ºC; para z > 0,80 la temperatura peritéctica disminuye hasta ~ 700 ºC a z = 1,0. La transición de líquido L a (L+ZnSe), está dada por la línea frontera entre 1075 ºC a z = 0 y ~ 770 ºC a z ~ 0,80. La región del diagrama por debajo de los 600 ºC corresponde a la aparición de la fase tetragonal estannita, como lo indica el estudio por difracción de rayos-X a
temperatura ambiente.",https://zenodo.org/api/files/1d8aca97-e7ff-467d-8f89-d1b38d9b3876/1044%284%29%2050-59.pdf,pdf
52,EFFECT OF REPLACEMENT OF NATURAL SAND WITH BLASTED COPPER SLAG ON  MORTARS PHYSICAL AND MECHANICAL PROPERTIES,10.5281/zenodo.7397130,"Melo, Rafaela, Sales, Angela, Sales, Daniel, Oliveira, Rosane",2021-05-31,"Environmental preservation is a widely discussed topic throughout society, due to heavy reliance on natural resources for survival on the planet. Rational use of raw materials and their proper disposal are on the agenda of the productive sectors’ major concerns. This work aimed to evaluate the feasibility of application of copper slag waste, after being used as an abrasive material, coming to be called blasted copper slag. It was intended to replace sand to blasted copper slag in mortars, into two fractions, named fine and coarse blasted slag sand, according to the number of times that were used in the abrasive process. Four mixtures were produced, for each type of blasted slag, with levels of 25%, 50%, 75% and 100% of replacement to natural sand, in addition to the reference mortar. The consistence of fresh mortars was measured by the flow table test and the spreading range was fixed for 270 ± 20 mm. Physical and mechanical tests were performed with produced mortars. Mortars with blasted copper slag, both fine and coarse slag, demanded lower water/binders ratio to achieve the desired spreading, compared to the reference mixture. Mechanical tests showed important performance reductions in compression strength of the mortars with fine blasted slag, both in relation to the reference mortar, and when compared to mortars with same replacement content of natural sand by coarse blasted slag. It could be concluded that, for levels between 25 and 50% of natural aggregate replacement by coarse blasted slag, there is feasibility of most mortar application, since there are not required high levels of strength and stiffness.",https://zenodo.org/api/files/36b24188-d17a-48e7-8438-48b36628d11e/1069%286%29%2074-87.pdf,pdf
