,Titre,DOI,Auteurs,Date de publication,Abstract,Lien fichier,Type fichier,Abstract_lemm
64,"PERFORMANCE EVALUATION OF WATER TREATMENT UNITS AT BHADRAVATHI, KARNATAKA: A CASE STUDY",10.5281/zenodo.834622,"Meghana M *1, Manjunath N T 2",2017-07-25,"The need of the day is sustainable supply of portable water for human consumption so that health and wellbeing of the community can be addressed. Furthermore treating of the polluted water and making it safe for drinking and domestic use is the main challenge for the world today. However proper design and commissioning of treatment plants only may not ensure its proper functioning but it requires frequent evaluation of performance of various units of treatment plant. Skilful plant operation and attention to the requirements of the sources of supply and distribution system are equally important to guarantee safe drinking water supply. In this paper an attempt has been made to take stalk of performance evaluation of various water treatment units. The study revealed that treatment units are functioning satisfactorily and treated water is meeting drinking water quality standards prescribed by BIS. The work is an outcome of M.Tech dissertation.
 ",https://zenodo.org/api/files/2bc7a2cc-339d-4b1b-847f-e03d5e2d2ae8/meghana%20m.doc,doc,"the need of the day be sustainable supply of portable water for human consumption so that health and wellbeing of the community can be address . furthermore treat of the polluted water and make it safe for drinking and domestic use be the main challenge for the world today . however proper design and commissioning of treatment plant only may not ensure its proper functioning but it require frequent evaluation of performance of various unit of treatment plant . skilful plant operation and attention to the requirement of the source of supply and distribution system be equally important to guarantee safe drinking water supply . in this paper an attempt have be make to take stalk of performance evaluation of various water treatment unit . the study reveal that treatment unit be function satisfactorily and treat water be meet drink water quality standard prescribe by BIS . the work be an outcome of m.tech dissertation . 
 "
65,Water Purification by Activation Plasma Technology,10.35940/ijisme.H1251.076820,"Chandan Kumar, Ankit Raj Sinha, Sanjay Prakash, Khushwant Singh, Saurabh Kumar",2020-07-15,"In modern water treatment technologies Water needs to be processed to a level that can be reused in a meaningful way. Plasma production or plasma injection in liquid water provides an opportunity to inject advanced Oxidation processes in water for purification or chemical processing. Such technology can revolutionize Drinking water treatment, as well as current practices of chemical processing by removing physical catalysts. An overview of current water treatment is presented here where Technology, its limitations and the future, may include Plasma-based advanced oxidation method. In plasma Introduction to liquid water produces and attacks a host of reactive species finally mineralize the contaminants in the solution. This interaction takes place at the boundary layer or at the interaction zone is concentrated at the plasma - liquid water interface. There are limitations of traditional plasma injection procedures which include limited throughput capacity, electrode shear and reduced Process Volume. Here the technical limitations of plasma based water reactor will also be discussed.",https://zenodo.org/api/files/4d8ad7d4-b419-4db1-bdcb-25a4ba95260a/H1251076820.pdf,pdf,"in modern water treatment technology Water need to be process to a level that can be reuse in a meaningful way . plasma production or plasma injection in liquid water provide an opportunity to inject advanced Oxidation process in water for purification or chemical processing . such technology can revolutionize drinking water treatment , as well as current practice of chemical processing by remove physical catalyst . an overview of current water treatment be present here where Technology , its limitation and the future , may include Plasma - base advanced oxidation method . in plasma introduction to liquid water produce and attack a host of reactive specie finally mineralize the contaminant in the solution . this interaction take place at the boundary layer or at the interaction zone be concentrate at the plasma - liquid water interface . there be limitation of traditional plasma injection procedure which include limit throughput capacity , electrode shear and reduce Process Volume . here the technical limitation of plasma base water reactor will also be discuss ."
66,Amoxicillin degradation pathways and mass spectra raw data  (using LC-MS orbitrap),10.5281/zenodo.7066083,"dela Rosa, Francis",2022-09-10,"The link provides five documents namely:
File No.1  (Proposed Chemical Structures-tabulated)
File No.2  (MS and MS2 images) support for File no.1
File No.3 Transformation Products Pathway
File No.4 Explanation + Justification of proposed chemical structures
Raw Data obtained from compound discoverer",https://zenodo.org/api/files/9783baf6-5916-40a7-9552-365c1dc15b3f/Amoxicillin%20and%20TPS%20Raw%20Data.xlsx,xlsx,"the link provide five document namely : 
 file no.1   ( Proposed Chemical Structures - tabulate ) 
 File no.2   ( MS and MS2 image ) support for File no.1 
 File no.3 Transformation Products Pathway 
 File no.4 Explanation + Justification of propose chemical structure 
 raw datum obtain from compound discoverer"
67,Treatment of Eutrophic-lake Water by Free Water Surface Wetland,10.5281/zenodo.1332056,"Haodong Wu, Ping Huang, Junsan Wang",2010-07-25,"In China, with the rapid urbanization and
industrialization, and highly accelerated economic development have
resulted in degradation of water resource. The water quality
deterioration usual result from eutrophication in most cases, so how to
dispose this type pollution water higher efficiently is an urgent task.
Hower, different with traditional technology, constructed wetlands are
effective treatment systems that can be very useful because they are
simple technology and low operational cost. A pilot-scale treatment
including constructed wetlands was constructed at XingYun Lake,
Yuxi, China, and operated as primary treatment measure before
eutrophic-lake water draining to riverine landscape. Water quality
indices were determined during the experiment, the results indicated
that treatment removal efficiencies were high for Nitrate nitrogen,
Chlorophyll–a and Algae, the final removal efficiency reached to
95.20%, 93.33% and 99.87% respectively, but the removal efficiency
of Total phosphorous and Total nitrogen only reach to 68.83% and
50.00% respectively.",https://zenodo.org/api/files/9209f466-acab-4a09-a7c3-70e09e1d2bbf/4325.pdf,pdf,"in China , with the rapid urbanization and 
 industrialization , and highly accelerate economic development have 
 result in degradation of water resource . the water quality 
 deterioration usual result from eutrophication in most case , so how to 
 dispose this type pollution water higher efficiently be an urgent task . 
 Hower , different with traditional technology , construct wetland be 
 effective treatment system that can be very useful because they be 
 simple technology and low operational cost . a pilot - scale treatment 
 include construct wetland be construct at XingYun Lake , 
 Yuxi , China , and operate as primary treatment measure before 
 eutrophic - lake water drain to riverine landscape . water quality 
 index be determine during the experiment , the result indicate 
 that treatment removal efficiency be high for nitrate nitrogen , 
 chlorophyll – a and Algae , the final removal efficiency reach to 
 95.20 % , 93.33 % and 99.87 % respectively , but the removal efficiency 
 of total phosphorous and total nitrogen only reach to 68.83 % and 
 50.00 % respectively ."
68,Aerobic wastewater treatment technologies: A mini review,10.5281/zenodo.4784991,"Tumpa Mondal, Ankan Jana, Debajyoti Kundu",2021-05-25,"Treatment of sewage water from industries or domestic becomes very crucial in present days. For concentrated industrial wastewater aerobic treatment is a substitute to the slower anaerobic treatment processes. Due to its low operation and maintenance costs, use of aerobic waste water treatment as a reductive medium is getting increased attention. In addition, this is very easy-to-obtain, with well effectiveness and ability for degrading contaminants. In this article, the use of aerobic waste water treatment technologies to remove contaminants present in wastewater, which represent the main pollutants in wastewater, has been reviewed. The review concludes that suspended growth bioreactors are very efficient at low organic loading rates for treating wastewaters. Most of the biofilm reactors have a same level of COD removal.",https://zenodo.org/api/files/d8c745b5-bfbc-4ea5-bbc9-f73c341f5947/Int-J-Env-Tech-Sci-4-135%E2%80%93140%20%281%29.pdf,pdf,"treatment of sewage water from industry or domestic become very crucial in present day . for concentrated industrial wastewater aerobic treatment be a substitute to the slow anaerobic treatment process . due to its low operation and maintenance cost , use of aerobic waste water treatment as a reductive medium be get increase attention . in addition , this be very easy - to - obtain , with well effectiveness and ability for degrading contaminant . in this article , the use of aerobic waste water treatment technology to remove contaminant present in wastewater , which represent the main pollutant in wastewater , have be review . the review conclude that suspend growth bioreactor be very efficient at low organic loading rate for treat wastewater . Most of the biofilm reactor have a same level of COD removal ."
69,Influence of the Pre-Treatment and Post-Treatment Operations on the Surface Chemistry and Corrosion Behavior of Cerium-Based Conversion Coatings on Aluminum,10.5281/zenodo.5084173,"R. Andreeva, E. Stoyanova, A. Tsanev, D. Stoychev",2021-05-17,"We investigated the corrosion-protective action of chemically deposited in green Ce solution conversion Cerium oxide coatings on technically pure aluminum (Al 1050) that were subsequently immersion-treated in phosphate solutions. A comparative study was conducted regarding the effect of: the type of pretreatment of the Аl substrate; the conversion treatment of the Аl substrate in Се-containing or Р-containing solutions; the consecutive conversion treatment of the Аl substrate in Се-containing and Р-containing solutions. The obtained results indicate that the pre-treatment of the aluminum substrate and the additional phosphate treatment of the Ce-oxide conversion coating deposited on Al 1050 have a strong impact on corrosion-protective effect. We established that the phosphate treatments lead to a transformation of the chemical composition, chemical state of the elements, structure and morphology of the Ce-oxide coatings formed on Al substrates. Oxides and phosphates of Al and Ce are formed, providing an effective barrier to the diffusion of Chloride ions towards the metal surface and increased corrosion resistance (Rp) of Al 1050 to general and pitting corrosion. We have established a marked increase in Rp for one of the model systems (Al(NaOH)/ CCOC(Ce+Cu)/PhL(NH4H2PO4)) during extended corrosion tests, which was related to the formation of poorly soluble surface corrosion products.",Inconnu,Inconnu,"we investigate the corrosion - protective action of chemically deposit in green Ce solution conversion cerium oxide coating on technically pure aluminum ( Al 1050 ) that be subsequently immersion - treat in phosphate solution . a comparative study be conduct regard the effect of : the type of pretreatment of the Аl substrate ; the conversion treatment of the Аl substrate in се - contain or р - contain solution ; the consecutive conversion treatment of the Аl substrate in се - contain and р - contain solution . the obtain result indicate that the pre - treatment of the aluminum substrate and the additional phosphate treatment of the Ce - oxide conversion coating deposit on Al 1050 have a strong impact on corrosion - protective effect . we establish that the phosphate treatment lead to a transformation of the chemical composition , chemical state of the element , structure and morphology of the Ce - oxide coating form on Al substrate . Oxides and phosphate of Al and Ce be form , provide an effective barrier to the diffusion of Chloride ion towards the metal surface and increase corrosion resistance ( Rp ) of Al 1050 to general and pit corrosion . we have establish a marked increase in Rp for one of the model system ( Al(NaOH)/ CCOC(Ce+Cu)/PhL(NH4H2PO4 ) ) during extended corrosion test , which be relate to the formation of poorly soluble surface corrosion product ."
70,Modification and Advancements in the Traditional Method of Water Purification,10.31142/ijtsrd14426,"Aaliya Rafiq Hakak, Shubham Bankhele, Rajat Malpani, P. S. Bhamare",2018-10-09,"India is facing a water crisis and by 2025 it is estimated that India's population will be suffering from severe water scarcity. International Water management Institute IWMI predicts that by 2025, one in three Indians will live in a condition of absolute water scarcity. Water from the industries, households, etc. has been discharged into the streams without being treated first. Thus, clean water has become a luxury in many water scarce areas. Due to the consumption of contaminated water, people are falling prey to water borne diseases such as cholera, typhoid, etc. The widely used approach to counter such problem has been the use of water treatment plants in cities and towns and water filters in households. However, in a developing country like India water treatment plants and filters in small villages are a rare sight. The major reason for this is the funds required. Also, the processes that are in existence for water treatment are primarily chemical based. With the discovery of processes like phytoremediation, it has become possible to incorporate biological processes in water treatment Piyush Gupta et al. 2012 . Moreover the voids between broken bricks, etc. can be used to trap sediments. Natural coagulants such as moringa oleifera can be used to remove colloidal impurities Abirami. M and Rohini C 2017 . Thus, this assembly of scrap or natural material is not only cheap and easily available but it is also efficient in removing the impurities and improving the BOD, COD and DO levels Nayanthara and Bindu 2017 . This implies that such assemblies can be used to treat water on a household level. This study aims at developing such easy to use and effective water treatment assemblies. Aaliya Rafiq Hakak | Shubham Bankhele | Rajat Malpani | P. S. Bhamare ""Modification and Advancements in the Traditional Method of Water Purification"" Published in International Journal of Trend in Scientific Research and Development (ijtsrd), ISSN: 2456-6470, Volume-2 | Issue-6 , October 2018, URL: https://www.ijtsrd.com/papers/ijtsrd14426.pdf",https://zenodo.org/api/files/9bec0f50-a1b4-4605-b55a-73bdb4cd3daa/233%20Modification%20and%20Advancements%20in%20the%20Traditional%20Method%20of%20Water%20Purification.pdf,pdf,"India be face a water crisis and by 2025 it be estimate that India 's population will be suffer from severe water scarcity . International Water management Institute IWMI predict that by 2025 , one in three Indians will live in a condition of absolute water scarcity . water from the industry , household , etc . have be discharge into the stream without be treat first . thus , clean water have become a luxury in many water scarce area . due to the consumption of contaminate water , people be fall prey to water borne disease such as cholera , typhoid , etc . the widely use approach to counter such problem have be the use of water treatment plant in city and town and water filter in household . however , in a develop country like India water treatment plant and filter in small village be a rare sight . the major reason for this be the fund require . also , the process that be in existence for water treatment be primarily chemical base . with the discovery of process like phytoremediation , it have become possible to incorporate biological process in water treatment Piyush Gupta et al . 2012 . moreover the voids between broken brick , etc . can be use to trap sediment . natural coagulant such as moringa oleifera can be use to remove colloidal impurity Abirami . M and Rohini C 2017 . thus , this assembly of scrap or natural material be not only cheap and easily available but it be also efficient in remove the impurity and improve the BOD , COD and DO level Nayanthara and Bindu 2017 . this imply that such assembly can be use to treat water on a household level . this study aim at develop such easy to use and effective water treatment assembly . Aaliya Rafiq Hakak | Shubham Bankhele | Rajat Malpani | P. S. Bhamare "" Modification and Advancements in the Traditional Method of Water Purification "" publish in International Journal of Trend in Scientific Research and Development ( ijtsrd ) , ISSN : 2456 - 6470 , Volume-2 | Issue-6 , October 2018 , URL : https://www.ijtsrd.com/papers/ijtsrd14426.pdf"
71,danielf27/Dynamic-Voltage-Pulses-for-the-Improvement-of-the-Cerium-III-Oxidation-Reaction: Version 1,10.5281/zenodo.6461874,danielf27,2022-04-14,"This is the release of the code for the paper entitles ""Dynamic-Voltage-Pulses-for-the-Improvement-of-the-Cerium-III-Oxidation-Reaction""",https://zenodo.org/api/files/6ba4ad63-be1c-4e60-98b8-d14fef96ebd0/danielf27/Dynamic-Voltage-Pulses-for-the-Improvement-of-the-Cerium-III-Oxidation-Reaction-v1.0.zip,zip,"this be the release of the code for the paper entitle "" dynamic - voltage - pulses - for - the - improvement - of - the - Cerium - III - Oxidation - reaction """
72,CATALYTIC FORMATION OF METHANE FROM CARBON  MONOXIDE AND HYDROGEN. PART V. A STUDY  OF THE PROMOTER EFFECT UPON NICKEL  CATALYST.,10.5281/zenodo.6630562,K. M. CHAKRAVARTY,1938-12-31,The reduction of nickel catalyst at a temperature of 300° is incomplete when prepared from a very pare sample of nickel acetate. Addition of a small quantity of a mixture of cerium nitrate and ammonium vanadate or of cerium nitrate and chromium acetate to the nickel acetate helps in bringing about a more thorough reduction Thus catalysis of the reaction 2CO+2H2=CO2+CH4 is directly accelerated by them Whether there is any direct beneficial effect of the promoters cannot be said at this stage.,https://zenodo.org/api/files/c8aa72c9-29b2-412e-aedd-a2d477347d65/245-248.pdf,pdf,the reduction of nickel catalyst at a temperature of 300 ° be incomplete when prepare from a very pare sample of nickel acetate . addition of a small quantity of a mixture of cerium nitrate and ammonium vanadate or of cerium nitrate and chromium acetate to the nickel acetate help in bring about a more thorough reduction thus catalysis of the reaction 2CO+2H2 = CO2+CH4 be directly accelerate by they whether there be any direct beneficial effect of the promoter can not be say at this stage .
73,A Study on Sewage Treatment and its Reuse for Gardening Purposes,10.5281/zenodo.1490354,"V. Ramakrishna, A.R.Kishore Kumar Reddy, A. Dileep Kumar Reddy, N. Sandeep Kumar, P. Chandrasekhar Subrahmanyam",2018-11-17,"
Sewage or waste water treatment and its possible recycling is the need of the hour in view of
heavy demand on natural water resources. Indiscriminate disposal of sewage deteriorates the
quality of available water. The present study focuses on studying the sewage treatment
options for possible reuse for gardening purposes in an academic Institute. Three options are
considered (i) conventional secondary treatment without recycle (ii) conventional treatment
with recycle (iii) only primary treatment. Bench top model of sewage treatment plant is set up
and experiments are conducted for the above options. pH, TS, TSS, BOD and COD values
are determined in the laboratory to determine the efficiency of the treatment plant. Cow dung
and urea are added as seed and nutrient for the bacterial growth in the treatment plant. It is
noticed that the sewage requires only primary treatment and a detention time of above 2
hours is sufficient to reduce TSS by 58% to be safely used for gardening.",https://zenodo.org/api/files/10bb057f-8e1e-4fb5-acf7-da4a7ac543e3/%2825-32%29A%20Study%20on%20Sewage%20Treatment-format.pdf,pdf,"
 Sewage or waste water treatment and its possible recycling be the need of the hour in view of 
 heavy demand on natural water resource . indiscriminate disposal of sewage deteriorate the 
 quality of available water . the present study focus on study the sewage treatment 
 option for possible reuse for garden purpose in an academic Institute . three option be 
 consider ( i ) conventional secondary treatment without recycle ( ii ) conventional treatment 
 with recycle ( iii ) only primary treatment . Bench top model of sewage treatment plant be set up 
 and experiment be conduct for the above option . pH , TS , TSS , BOD and COD value 
 be determine in the laboratory to determine the efficiency of the treatment plant . cow dung 
 and urea be add as seed and nutrient for the bacterial growth in the treatment plant . it be 
 notice that the sewage require only primary treatment and a detention time of above 2 
 hour be sufficient to reduce TSS by 58 % to be safely use for gardening ."
74,Transcatheter aortic valve implantation via transaortic surgical access,10.3897/bgcardio.28.e83660,"Popova, A., Trendafilova, D., Jorgova, J., Petkov, D., Abedinov, F., Hristova, T., Ivanov, S.",2022-06-20,"We report a case of an 80-years–old patient with a severe, symptomatic aortic valve stenosis and history of ischemic heart disease, previously treated by coronary artery bypass graft surgery. The patient was contraindicated for conventional surgical aortic valve replacement (SAVR) due to advanced age and underlying comorbidity, therefore transcatheter aortic valve implantation (TAVI) has been offered. The access options for the procedure were restricted by the underlying generalized atherosclerosis process causing peripheral vessel disease. We have chosen transaortic access for the patient which in that case was the only possible option. The transaortic valve implantation was successful with satisfactory hemodynamic results, improvement in functional class heart failure of the patient and preserving the function and anatomy of the coronary artery bypass graft. This case report demonstrates that the lack of favorable transfemoral access for TAVI should not be a limitation by itself for the procedure, rather than be stimulus for searching and using new and alternative access for it.",https://zenodo.org/api/files/61593843-cafe-4001-be39-31846fd1a214/Bulgarian_Cardiology_article_83660.pdf,pdf,"we report a case of an 80 - year – old patient with a severe , symptomatic aortic valve stenosis and history of ischemic heart disease , previously treat by coronary artery bypass graft surgery . the patient be contraindicate for conventional surgical aortic valve replacement ( savr ) due to advanced age and underlie comorbidity , therefore transcatheter aortic valve implantation ( tavi ) have be offer . the access option for the procedure be restrict by the underlie generalized atherosclerosis process cause peripheral vessel disease . we have choose transaortic access for the patient which in that case be the only possible option . the transaortic valve implantation be successful with satisfactory hemodynamic result , improvement in functional class heart failure of the patient and preserve the function and anatomy of the coronary artery bypass graft . this case report demonstrate that the lack of favorable transfemoral access for tavi should not be a limitation by itself for the procedure , rather than be stimulus for search and use new and alternative access for it ."
