,Titre,DOI,Auteurs,Date de publication,Abstract,Lien fichier,Type fichier,Abstract_lemm
18,"Technology Identification, Evaluation and Selection Methodology for Industrial Process Water and Waste Water Treatment Plant of 3x150 MWe Tufanbeyli Lignite-Fired Power Plant",10.5281/zenodo.1124249,Cigdem Safak Saglam,2016-03-02,"Most thermal power plants use steam as working fluid in their power cycle. Therefore, in addition to fuel, water is the other main input for thermal plants. Water and steam must be highly pure in order to protect the systems from corrosion, scaling and biofouling. Pure process water is produced in water treatment plants having many several treatment methods. Treatment plant design is selected depending on raw water source and required water quality. Although working principle of fossil-fuel fired thermal power plants are same, there is no standard design and equipment arrangement valid for all thermal power plant utility systems. Besides that, there are many other technology evaluation and selection criteria for designing the most optimal water systems meeting the requirements such as local conditions, environmental restrictions, electricity and other consumables availability and transport, process water sources and scarcity, land use constraints etc. Aim of this study is explaining the adopted methodology for technology selection for process water preparation and industrial waste water treatment plant in a thermal power plant project located in Tufanbeyli, Adana Province in Turkey. Thermal power plant is fired with indigenous lignite coal extracted from adjacent lignite reserves. This paper addresses all above-mentioned factors affecting the thermal power plant water treatment facilities (demineralization + waste water treatment) design and describes the ultimate design of Tufanbeyli Thermal Power Plant Water Treatment Plant.",https://zenodo.org/api/files/c585d729-aa9a-4add-9d34-801794a4cd0d/10004402.pdf,pdf,"Most thermal power plant use steam as work fluid in their power cycle . therefore , in addition to fuel , water be the other main input for thermal plant . water and steam must be highly pure in order to protect the system from corrosion , scaling and biofouling . pure process water be produce in water treatment plant have many several treatment method . treatment plant design be select depend on raw water source and require water quality . although work principle of fossil - fuel fire thermal power plant be same , there be no standard design and equipment arrangement valid for all thermal power plant utility system . besides that , there be many other technology evaluation and selection criterion for design the most optimal water system meet the requirement such as local condition , environmental restriction , electricity and other consumable availability and transport , process water source and scarcity , land use constraint etc . Aim of this study be explain the adopt methodology for technology selection for process water preparation and industrial waste water treatment plant in a thermal power plant project locate in Tufanbeyli , Adana Province in Turkey . thermal power plant be fire with indigenous lignite coal extract from adjacent lignite reserve . this paper address all above - mention factor affect the thermal power plant water treatment facility ( demineralization + waste water treatment ) design and describe the ultimate design of Tufanbeyli Thermal Power Plant Water Treatment Plant ."
19,IDENTIFICATION OF SPECIAL FEATURES IN THE ELECTROLYSIS­CAVITATION WATER TREATMENT IN POOLS,10.15587/1729-4061.2019.162229,"Liliya Shevchuk, Ivan Aftanaziv, Lesya Strutynska, Orysia Strogan, Igor Samsin",2019-04-30,"We developed an innovative technology of electrolysis-cavitation water purification and water treatment in pools. This method belongs to the group of physical water purification methods and its advantage is the absence of the need for costly chemical disinfectants and a degree of water purification from biological and organic pollutants of up to 97–98 %. A typical electrolytic water treatment process, based on electrolysis disengagement of sodium chloride with the formation of reactive sodium hypochlorite, is complemented by the operation of water cavitation disinfection from organic and biological pollutants. Prior to the electrolysis, the cavitation treatment of water in pools reduces by 75‒80 % the degree of its contamination, reduces approximately by two times the need in disinfectant produced by electrolysis installations. This proportionally reduces by 45–50 % the duration of energy-consuming electrolysis equipment operation and reduces by one-third the costs of electricity for water treatment operations.
For cavitation disinfection of water in pools, we have devised a new design of an industrial variant of the vibrocavitator with a resonance effect, studied the conditions for disturbing the cavitation processes within it, and developed a procedure for the design and calculation of its main components and parts. The block of vibrocavitators that precedes electrolysis water treatment ensures the oxidation of organic impurities in polluted water, including urea, to 75–77 %. The degree of biological water disinfection in this case reaches 80–82 % with a capacity of 3–3.5 m3/hour.
The power of electromagnets in a vibrocavitator drive is 1–1.5 kW, which is an order of magnitude less compared to the power of electrolysis installations. Given this, the proposed phased cavitation and electrolysis water treatment reduces the total energy consumption for a water treatment operation. For standard pools with a water volume of 3,000 m3 with electrolysis water treatment, the introduction of additional cavitation treatment will make it possible to reduce monthly energy consumption for a water treatment operation by about 1,200‒1,500 kW.
We have considered the legal aspects for implementing the proposed solutions in terms of the production implementation of the electrolysis-cavitation water treatment process and improving the safety of users of water procedures and services",https://zenodo.org/api/files/01b0d5b9-c3e6-4d3c-99fe-e97dd1b3c9f4/Identification%20of%20special%20features%20in%20the%20electrolysis%C2%ADcavitation%20water%20treatment%20in%20pools.pdf,pdf,"we develop an innovative technology of electrolysis - cavitation water purification and water treatment in pool . this method belong to the group of physical water purification method and its advantage be the absence of the need for costly chemical disinfectant and a degree of water purification from biological and organic pollutant of up to 97–98 % . a typical electrolytic water treatment process , base on electrolysis disengagement of sodium chloride with the formation of reactive sodium hypochlorite , be complement by the operation of water cavitation disinfection from organic and biological pollutant . prior to the electrolysis , the cavitation treatment of water in pool reduce by 75‒80 % the degree of its contamination , reduce approximately by two time the need in disinfectant produce by electrolysis installation . this proportionally reduce by 45–50 % the duration of energy - consume electrolysis equipment operation and reduce by one - third the cost of electricity for water treatment operation . 
 for cavitation disinfection of water in pool , we have devise a new design of an industrial variant of the vibrocavitator with a resonance effect , study the condition for disturb the cavitation process within it , and develop a procedure for the design and calculation of its main component and part . the block of vibrocavitator that precede electrolysis water treatment ensure the oxidation of organic impurity in polluted water , include urea , to 75–77 % . the degree of biological water disinfection in this case reach 80–82 % with a capacity of 3–3.5 m3 / hour . 
 the power of electromagnet in a vibrocavitator drive be 1–1.5 kW , which be an order of magnitude less compare to the power of electrolysis installation . give this , the propose phase cavitation and electrolysis water treatment reduce the total energy consumption for a water treatment operation . for standard pool with a water volume of 3,000 m3   with electrolysis water treatment , the introduction of additional cavitation treatment will make it possible to reduce monthly energy consumption for a water treatment operation by about 1,200‒1,500 kW. 
 we have consider the legal aspect for implement the propose solution in term of the production implementation of the electrolysis - cavitation water treatment process and improve the safety of user of water procedure and service"
20,Synthesis and Ion Exchange Properties of Cerium(IV) Tellurite,10.5281/zenodo.6376086,"SYED ASHFAQ NABI, RIFAQAT ALI KHAN RAO",1981-11-30,"Department of Chemistry, Aligarh Muslim University, Aligarh-202 001
Manuscript received 10 February 1981, revised 24 August 1981, accepted 31 August 1981
Cerium(IV) tellurite has been synthesized as a new inorganic cation exchanger by mixing solutions of cerium(IV) ammonium sulphate and tellurous acid of different concentrations and at different pH values. Ion exchange capacity of sample 5 at pH=6 is 0.90 meq/dry gm for Na+ ions. The chemical composition, thermal and chemical stability, pH titrations, ir studies, thermogravimetric and differential thermal analysis have also been performed. Cerium tellurite is found to be chemically more stable than chromium tellurate.",https://zenodo.org/api/files/6f38b7f7-03f7-4c30-8d1e-6f2f5d4083e4/1030-1032.pdf,pdf,"Department of Chemistry , Aligarh Muslim University , Aligarh-202 001 
 Manuscript receive 10 February 1981 , revise 24 August 1981 , accept 31 August 1981 
 cerium(iv ) tellurite have be synthesize as a new inorganic cation exchanger by mix solution of cerium(IV ) ammonium sulphate and tellurous acid of different concentration and at different ph value . Ion exchange capacity of sample 5 at pH=6 be 0.90 meq / dry gm for Na+   ion . the chemical composition , thermal and chemical stability , ph titration , ir study , thermogravimetric and differential thermal analysis have also be perform . cerium tellurite be find to be chemically more stable than chromium tellurate ."
21,Grey water footprint of pollution discharged from waste water treatment plants in the Czech Republic (2002-2018) – data set,10.5281/zenodo.4915815,"Libor Ansorge, Jiří Dlabal, Lada Stejskalová",2021-03-13,"The data set contains grey water footprint values for discharges from wastewater treatment plants in the Czech Republic. The grey water footprint is a qualitative indicator converting the discharged pollution into the volume of water needed to dilute pollutants to such an extent that the quality of the ambient water remains above agreed water quality standards. Information on the grey water footprint of individual sources of pollution can be used by all stakeholders involved in water quality assessment, water footprint assessment, environmental impact assessment, sustainability of water resource use, etc. The data on wastewater treatment plants registered in the water balance pursuant to Order No 431/2001 Sb. for the period 2002 to 2018 have been analysed and the water footprint of pollution of influent to treatment plants and of effluent from treatment plants has been established.",https://zenodo.org/api/files/beef5245-88ae-4866-b5de-da759eb7ec00/GWF_WWTPs_CR_2002-18_public.csv,csv,"the datum set contain grey water footprint value for discharge from wastewater treatment plant in the Czech Republic . the grey water footprint be a qualitative indicator convert the discharged pollution into the volume of water need to dilute pollutant to such   an extent that the quality of the ambient water   remain above agree water quality standard . information on the grey water footprint of individual source of pollution can be use by all stakeholder involve in water quality assessment , water footprint assessment , environmental impact assessment , sustainability of water resource use , etc . the datum on wastewater treatment plant register in the water balance pursuant to order No 431/2001 Sb . for the period 2002 to 2018 have be analyse and the water footprint of pollution of influent   to treatment plant and of effluent from treatment plant have be establish ."
22,Data from: Hybrid system increases efficiency of ballast water treatment,10.5061/dryad.rm83s,"Paolucci, Esteban M., Hernandez, Marco R., Potapov, Alexei, Lewis, Mark A., MacIsaac, Hugh J.",2015-02-02,"1. Ballast water has been a principal pathway of nonindigenous species introduction to global ports for much of the 20th century. In an effort to reduce the scale of this pathway, and recognizing forthcoming global regulations that will supplant ballast water exchange (BWE) with ballast water treatment (BWT), we explore whether a combined hybrid treatment of BWE and chlorination (Cl) exceeds individual effects of either BWE or chlorination alone in reducing densities of bacteria, microplankton and macroplankton. 2. Five full-scale trials were conducted on an operational bulk carrier travelling between Canada and Brazil. 3. The hybrid treatment generally had the lowest final densities among all treatments for putative enterococci, Escherichia coli, and coliform bacteria, as well as microplankton and macroplankton, with the former two being synergistically lower than individual treatments alone. Microplankton abundance in the hybrid treatment was significantly but antagonistically reduced relative to individual treatments alone. Macroplankton final density was lowest in the hybrid treatment, though the interaction between treatments was not significant. 4. Synthesis and applications. In most cases the combined hybrid treatment of ballast water exchange (BWE) and chlorination reduced population densities of indicator organisms in ballast water below those proposed by the International Maritime Organization's D-2 performance standards. BWE alone was often ineffective at reducing bacterial and macroplankton densities. Even when performance standards are implemented globally, continued use of BWE could further reduce risk of invasions to freshwater ecosystems that receive ballast water from foreign sources by accentuating the decline in propagule pressure and enhancing demographic constraints for putative invaders.",https://zenodo.org/api/files/c0cfcbf2-d702-4527-8b2c-1786d6e98bc5/Data%20Accessibility-Hybrid%20system%20increases%20efficiency%20of%20ballast%20water%20treatment.xlsx,xlsx,"1 . ballast water have be a principal pathway of nonindigenous specie introduction to global port for much of the 20th century . in an effort to reduce the scale of this pathway , and recognize forthcoming global regulation that will supplant ballast water exchange ( BWE ) with ballast water treatment ( BWT ) , we explore whether a combine hybrid treatment of BWE and chlorination ( Cl ) exceed individual effect of either BWE or chlorination alone in reduce density of bacteria , microplankton and macroplankton . 2 . five full - scale trial be conduct on an operational bulk carrier travel between Canada and Brazil . 3 . the hybrid treatment generally have the low final density among all treatment for putative enterococci , Escherichia coli , and coliform bacteria , as well as microplankton and macroplankton , with the former two be synergistically low than individual treatment alone . Microplankton abundance in the hybrid treatment be significantly but antagonistically reduce relative to individual treatment alone . Macroplankton final density be low in the hybrid treatment , though the interaction between treatment be not significant . 4 . synthesis and application . in most case the combine hybrid treatment of ballast water exchange ( BWE ) and chlorination reduce population density of indicator organism in ballast water below those propose by the International Maritime Organization 's d-2 performance standard . bwe alone be often ineffective at reduce bacterial and macroplankton density . even when performance standard be implement globally , continued use of BWE could far reduce risk of invasion to freshwater ecosystem that receive ballast water from foreign source by accentuate the decline in propagule pressure and enhance demographic constraint for putative invader ."
23,Ruthenium(III) mediated oxidation of succinic acid by cerium(IV) in aqueous sulphuric acid medium - A kinetic and mechanistic approach,10.5281/zenodo.5778976,"H. V. Rajeshwari, A. P. Savanur, S. T. Nandibewoor, S. A. Chimatadar",2010-03-31,"P.G. Department of Studies in Chemistry, Karnatak University, Dharwad-580 003, Karnataka, India
E-mail : schimatadar@gmail.com
Manuscript received 21 August 2009, accepted 24 August 2009
The oxidation of succinic acid by cerium(IV) has been studied spectrophotometrically in aqueous sulphuric acid medium at 298 K at constant ionic strength or 1.6 mol dm-3. A minute amount or ruthenium(lll) (10-6 mol dm-3) is sumcient to enhance the slow reaction between succinic acid and cerium(JV). The main reaction products are cerium(lll) and oxaloacetic acid. The stoichiometry is 1 : 4, that is[sue.acid] : [CeIV] == 1 : 4. The reaction is first order in both cerium(IV) and ruthnium(lll) concentrations. The order with respect to sue. acid concentration varies from first order to zero order, as the succinic acid concentration increases. Increase in sulphuric acid concentration decreases the reaction rate. The added sulphate and bisulpahte decreases the rate or reaction. The added product cerium(lll) retards the reaction rate. The active species or oxidant and catalyst are Ce(SO4)2 and [Ru(H2O)6]3+ respectively. Possible mechanism Is proposed. The activation parameters were determined with respect to slow step and reaction constants involved have been determined.",https://zenodo.org/api/files/37878c20-c447-48be-9365-030169c170f9/295-308.pdf,pdf,"P.G. Department of Studies in Chemistry , Karnatak University , Dharwad-580 003 , Karnataka , India 
 e - mail : schimatadar@gmail.com 
 Manuscript receive 21 August 2009 , accept 24 August 2009 
 the oxidation of succinic acid by cerium(IV ) have be study spectrophotometrically in aqueous sulphuric acid medium at 298 k at constant ionic strength or 1.6 mol dm-3 .   a minute amount or ruthenium(lll ) ( 10 - 6 mol dm-3 ) be sumcient to enhance the slow reaction between succinic acid and cerium(jv ) . the main reaction product be cerium(lll ) and oxaloacetic acid . the stoichiometry be 1 : 4 , that is[sue.acid ] : [ ceiv ] = = 1 : 4 . the reaction be first order in both cerium(iv ) and ruthnium(lll ) concentration . the order with respect to sue . acid concentration vary from first order to zero order , as the succinic acid concentration increase . increase in sulphuric acid concentration decrease the reaction rate . the add sulphate and bisulpahte decrease the rate or reaction . the add product cerium(lll ) retard the reaction rate . the active specie or oxidant and catalyst be ce(so4)2 and [ ru(h2o)6]3 + respectively . possible mechanism be propose . the activation parameter be determine with respect to slow step and reaction constant involve have be determine ."
24,Cerium,10.1126/science.35.907.776,"Emerson, B. K.",1912-05-17,,https://zenodo.org/api/files/f0eb969d-ffe6-47d2-a4ef-5d70c90873fa/article.pdf,pdf,nan
25,Opmerkingen aangaande de Suikerkwestie,10.1007/bf02201417,"Water, Toe",1878-03-01,,https://zenodo.org/api/files/2bf028d1-483a-411a-84fc-338c86deb688/article.pdf,pdf,nan
26,The experience with the water treatment plant  for artesian water with complex impurities,10.5281/zenodo.1408241,"KUNDENOK SVETLANA, POPOVA TATYANA, MEDVED PAULINE",2018-09-05,"In their article, the authors present the individual water treatment technology for boiler houses and for household and drinking needs they have developed, in which membrane nanofilters are used for modest water consumption.
The technological scheme makes it possible to operate in two modes: 1) water treatment for boiler house and 2) simultaneous water treatment for boiler house and for household and drinking requirements. The technology involves mixing the filtrate with the initial water which minimises costs and the resulting water quality meets the requirements. Presented are the peculiarities of the nanofiltration process which were to be taken into account when calculating the membrane nanofilters for water treatment as well as the results of the starting-up and adjustment works carried out with the authors’ participation when installing the water treatment plant made under the individual order of the DalVODGEO LLC and put on the market in Vladivostok in 2014-2016.",https://zenodo.org/api/files/dc80f815-e349-4097-9a26-28c3c8da44bc/2018-3-11.pdf,pdf,"in their article , the author present the individual water treatment technology for boiler house and for household and drinking need they have develop , in which membrane nanofilter be use for modest water consumption . 
 the technological scheme make it possible to operate in two mode : 1 ) water treatment for boiler house and 2 ) simultaneous water treatment for boiler house and for household and drinking requirement . the technology involve mix the filtrate with the initial water which minimise cost and the result water quality meet the requirement . present be the peculiarity of the nanofiltration process which be to be take into account when calculate the membrane nanofilter for water treatment as well as the result of the starting - up and adjustment work carry out with the author ’ participation when instal the water treatment plant make under the individual order of the dalvodgeo LLC and put on the market in vladivostok in 2014 - 2016 ."
27,NiO-CeO2 Nano-Catalyst for the Removal of Priority Organic Pollutants from Wastewater through Catalytic Wet Air Oxidation at Mild Conditions,10.5281/zenodo.1124653,"Anushree, Chhaya Sharma, Satish Kumar",2016-04-01,"Catalytic wet air oxidation (CWAO) is normally carried out at elevated temperature and pressure. This work investigates the potential of NiO-CeO2 nano-catalyst in CWAO of paper industry wastewater under milder operating conditions of 90 °C and 1 atm. The NiO-CeO2 nano-catalysts were synthesized by a simple co-precipitation method and characterized by X-ray diffraction (XRD), before and after use, in order to study any crystallographic change during experiment. The extent of metal-leaching from the catalyst was determined using the inductively coupled plasma optical emission spectrometry (ICP-OES). The catalytic activity of nano-catalysts was studied in terms of total organic carbon (TOC), adsorbable organic halides (AOX) and chlorophenolics (CHPs) removal. Interestingly, mixed oxide catalysts exhibited higher activity than the corresponding single-metal oxides. The maximum removal efficiency was achieved with Ce40Ni60 catalyst. The results indicate that the CWAO process is efficient in removing the priority organic pollutants from wastewater, as it exhibited up to 59% TOC, 55% AOX, and 54 % CHPs removal.",https://zenodo.org/api/files/f5fdfdd7-4102-46b1-af99-2ea1b6cccb94/10004605.pdf,pdf,"catalytic wet air oxidation ( CWAO ) be normally carry out at elevated temperature and pressure . this work investigate the potential of NiO - ceo2 nano - catalyst in CWAO of paper industry wastewater under milder operating condition of 90 ° c and 1 atm . the NiO - CeO2 nano - catalyst be synthesize by a simple co - precipitation method and characterize by x - ray diffraction ( XRD ) , before and after use , in order to study any crystallographic change during experiment . the extent of metal - leach from the catalyst be determine use the inductively couple plasma optical emission spectrometry ( ICP - OES ) . the catalytic activity of nano - catalyst be study in term of total organic carbon ( TOC ) , adsorbable organic halide ( AOX ) and chlorophenolic ( CHPs ) removal . interestingly , mixed oxide catalyst exhibit high activity than the corresponding single - metal oxide . the maximum removal efficiency be achieve with ce40ni60 catalyst . the result indicate that the CWAO process be efficient in remove the priority organic pollutant from wastewater , as it exhibit up to 59 % TOC , 55 % AOX , and 54 % CHPs removal ."
28,"A Spectrophotometric Study of Cerium (IV)-3,5-Dinitrosalicylic Acid Complex",10.5281/zenodo.6456732,"S. S. Dube, S. S. Dhindsa",1970-05-31,"A Spectrophotometric Study of Cerium (IV)-3,5-Dinitrosalicylic Acid Complex",https://zenodo.org/api/files/5b1b1881-6fc8-46e9-80ad-fdcf6bb07f4c/489-490.pdf,pdf,"a Spectrophotometric Study of Cerium ( IV)-3,5 - Dinitrosalicylic Acid Complex"
