,Titre,DOI,Auteurs,Date de publication,Abstract,Lien fichier,Type fichier,Abstract_lemm
41,Adoption of a Natural Coagulant (Moringa oleifera) in Domestic Water Treatment,10.5281/zenodo.6721889,"Balogun-Adeleye, R.M., Olasupo, I.A., Oke, S.O.",2022-06-30,Provision of clean water is a major challenge in developing countries due to increasing cost of chemicals used in water treatment. The search for sustainable and affordable natural plant material has been a subject of research for decades. This study aims to investigate the efficiency of Moringa oleifera as natural coagulant in domestic water treatment. Raw water sample was collected and analysed before and after treatment with the seeds powder at varying coagulant dosages. Maximum removal of turbidity and colour was observed at an optimum coagulant dose of 750 mg/l corresponding to removal efficiencies of 93% and 98% respectively. The quality of water improved as coagulant dose increased. The addition of Moringa oleifera to water did not cause any undesirable change in the water quality. This research recommends that Moringa oleifera should be grown locally and adopted as a natural coagulant for domestic water treatment in developing countries.,https://zenodo.org/api/files/073a4e83-161a-4e38-b18d-25930bbfc24c/V07-N01-117-124.pdf,pdf,provision of clean water be a major challenge in develop country due to increase cost of chemical use in water treatment . the search for sustainable and affordable natural plant material have be a subject of research for decade . this study aim to investigate the efficiency of Moringa oleifera as natural coagulant in domestic water treatment . raw water sample be collect and analyse before and after treatment with the seed powder at vary coagulant dosage . maximum removal of turbidity and colour be observe at an optimum coagulant dose of 750 mg / l correspond to removal efficiency of 93 % and 98 % respectively . the quality of water improve as coagulant dose increase . the addition of Moringa oleifera to water do not cause any undesirable change in the water quality . this research recommend that moringa oleifera should be grow locally and adopt as a natural coagulant for domestic water treatment in develop country .
42,Respon Pemberian Fermentasi Air Kelapa (Cocos nucifera L.) Terhadap Pertumbuhan Tanaman Selada Keriting (Lactuca sativa L. var. Grand rapids F1),10.5281/zenodo.5077203,"Windi Royani, Sulistyo Sidik Purnomo, Hayatul Rahmi",2021-07-07,"The experiments were implemented in Lebaksari, Wadas Village, East Telukjambe Subdistrict, Karawang County from April to June 2021. The study was compiled using experimental methods with a single factor Random Group (RAK) design. The factor tested was the use of a solution of coconut water fermentation (P) yield with 5 degrees, treatment repeated 5 times. The tariff used is P0 (without treatment), P1 (25% coconut water fermentation), P2 (50% coconut water fermentation), P3 (75% coconut water fermentation), and P4 (100% coconut water fermentation). There is a real influence from the result of giving a coconut water fermentation to the high observation parameters of 7 hst and 28 hst age plants. P2 treatment (50% coconut water fermentation) shows the best result at 7 hst age plant height of 11.40 cm and the best result at 28 hst age plant height contained on treatment P1 (25% coconut water fermentation) of 31.67 cm",https://zenodo.org/api/files/afc0956e-730a-440c-97c6-615c641f2042/24.%20Windy.docx,docx,"the experiment be implement in Lebaksari , Wadas Village , East Telukjambe Subdistrict , Karawang County from April to June 2021 . the study be compile use experimental method with a single factor Random Group ( RAK ) design . the factor test be the use of a solution of coconut water fermentation ( p ) yield with 5 degree , treatment repeat 5 time . the tariff use be P0 ( without treatment ) , P1 ( 25 % coconut water fermentation ) , P2 ( 50 % coconut water fermentation ) , P3 ( 75 % coconut water fermentation ) , and P4 ( 100 % coconut water fermentation ) . there be a real influence from the result of give a coconut water fermentation to the high observation parameter of 7 hst and 28 hst age plant . P2 treatment ( 50 % coconut water fermentation ) show the good result at 7 hst age plant height of 11.40 cm and the good result at 28 hst age plant height contain on treatment P1 ( 25 % coconut water fermentation ) of 31.67 cm"
43,Chemistry of Cerium (III). Part I. An Electrometric Study on the Quantitative Precipitation of Cerium (III) as Normal Selenite,10.5281/zenodo.6519735,"Sarju Prasad, Suresh Kumar",1963-06-30,The results of a series of conductometric titrations of cerium (III) against seleneous acid with an overall concentration of 70% ethanol have been reported; the possibility of carrying out direct as well as reverse titrations over a wide concentration range of cerium(III) is thereby concluded and the effect of ethanol concentra­tion has also been studied which under cited conditions lends support to the formation of cerous normal selenite [molar ratio of Ce (III): Se being 2:3].,https://zenodo.org/api/files/9505ef89-222f-4582-bda5-a2c4eac614e2/445-450.pdf,pdf,the result of a series of conductometric titration of cerium ( III ) against seleneous acid with an overall concentration of 70 % ethanol have be report ; the possibility of carry out direct as well as reverse titration over a wide concentration range of cerium(iii ) be thereby conclude and the effect of ethanol concentra­tion have also be study which under cite condition lend support to the formation of cerous normal selenite [ molar ratio of Ce ( III ): Se be 2:3 ] .
45,Malate Complexes of Lanthanum(lll) and Cerium(III),10.5281/zenodo.6405951,"NIRADA KUMAR MOHANTY, R. K. PATNAIK",1977-09-30,"Department of Chemistry, Regional Engg. College, Rourkela-769008, Orissa
Manuscript received 16 August 1976, revised 20 April 1977, accepted 10 May 1977
Lanthanum(lll) and Cerium(lll) form neutral complexes with malic acid below pH 6.4 and 6.1 respectively. The equilibrium constants of the reaction M3+ H2ML \(\rightleftharpoons\) C + 3H+ are 3.75 x 10-11 and 1 67 x 10-10, for lanthanum and cerium malate complexes respectively. The equilibrium constants of the reaction M3+  + ML--  \(\rightleftharpoons\) C + H+ are 1.57 x 10-3 and  2.05 x 10 -3   for lanthanum and cerium malates respectively.",https://zenodo.org/api/files/5d63f63b-64c3-4667-8dfb-0c5b9091e3c5/867-868.pdf,pdf,"Department of Chemistry , Regional Engg . College , Rourkela-769008 , Orissa 
 Manuscript receive 16 August 1976 , revise 20 April 1977 , accept 10 May 1977 
 Lanthanum(lll ) and Cerium(lll ) form neutral complex with malic acid below ph 6.4 and 6.1 respectively . the equilibrium constant of the reaction M3 +   H2ML   \(\rightleftharpoons\ ) c + 3h+ be 3.75 x 10 - 11 and 1 67 x 10 - 10 , for lanthanum and cerium malate complex respectively . the equilibrium constant of the reaction M3 +    + ML--   \(\rightleftharpoons\ )   C + H+   be 1.57 x 10 - 3   and    2.05 x 10 -3     for lanthanum and cerium malate respectively ."
46,Study of Clean Water Management in Water Treatment Plant Grand Cikarang City,10.5281/zenodo.6606646,"Nisa Nurhidayanti, Indah Setyo Riani, Nur Ilman Ilyas",2022-06-02,"In the last few months, residents of the North Cikarang GCC housing have complained that the water supplied by the PAPs is smelly, cloudy and unfit for bathing, washing dishes and clothes. This encourages the PAP developers to be able to improve the clean water treatment process so that it is suitable for residents to use. The purpose of this study is to analyze whether the management of the Grand Cikarang City WTP has met the quality standards of clean water quality in Indonesia. Clean water treatment process starting from intake, coagulation, flocculation, sedimentation, filtration, and reservoir. The results of the analysis at the Grand Cikarang City WTP, namely that the WTP has carried out procedural procedures in managing clean water treatment from the raw water stage, production to quality and distribution to consumers, namely residents of Grand Cikarang City housing and in providing chemicals such as alum and chlorine. WTP also pays attention to the maximum standard of chemical use, so as not to have an impact on consumer health, in order to meet quality standards before water is distributed to residents of housing as many as 7,643 housing units, but in the process of managing clean water in WTP there are problems, namely the quality of the results of WTP processing even though it is still enter the quality standard.",https://zenodo.org/api/files/b1f0c640-7000-40c7-aec8-f1bc7649a74d/2.pdf,pdf,"in the last few month , resident of the North Cikarang GCC housing have complain that the water supply by the pap be smelly , cloudy and unfit for bathe , wash dish and clothe . this encourage the PAP developer to be able to improve the clean water treatment process so that it be suitable for resident to use . the purpose of this study be to analyze whether the management of the Grand Cikarang City WTP have meet the quality standard of clean water quality in Indonesia . clean water treatment process start from intake , coagulation , flocculation , sedimentation , filtration , and reservoir . the result of the analysis at the Grand Cikarang City WTP , namely that the WTP have carry out procedural procedure in manage clean water treatment from the raw water stage , production to quality and distribution to consumer , namely resident of Grand Cikarang City housing and in provide chemical such as alum and chlorine . WTP also pay attention to the maximum standard of chemical use , so as not to have an impact on consumer health , in order to meet quality standard before water be distribute to resident of housing as many as 7,643 housing unit , but in the process of manage clean water in WTP there be problem , namely the quality of the result of WTP processing even though it be still enter the quality standard ."
47,Adsorption of Bovine Serum Albumin on CeO2,10.5281/zenodo.1097277,Roman Marsalek,2014-11-04,"Preparation of nanoparticles of cerium oxide and
adsorption of bovine serum albumin on them were studied. Particle
size distribution and influence of pH on zeta potential of prepared
CeO2 were determined. Average size of prepared cerium oxide
nanoparticles was 9 nm. The simultaneous measurements of the
bovine serum albumin adsorption and zeta potential determination of
the (adsorption) suspensions were carried out. The adsorption
isotherms were found to be of typical Langmuir type; values of the
bovine serum albumin adsorption capacities were calculated.
Increasing of pH led to decrease of zeta potential and decrease of
adsorption capacity of cerium oxide nanoparticles. The maximum
adsorption capacity was found for strongly acid suspension (am =
118 mg/g). The samples of nanoceria with positive zeta potential
adsorbed more bovine serum albumin on the other hand, the samples
with negative zeta potential showed little or no protein adsorption.
Surface charge or better say zeta potential of CeO2 nanoparticles
plays the key role in adsorption of proteins on such type of materials.",https://zenodo.org/api/files/d00d00ba-78ab-4e5d-8139-4bbffa67032b/9999940.pdf,pdf,"preparation of nanoparticle of cerium oxide and 
 adsorption of bovine serum albumin on they be study . particle 
 size distribution and influence of ph on zeta potential of prepare 
 CeO2 be determine . average size of prepared cerium oxide 
 nanoparticle be 9 nm . the simultaneous measurement of the 
 bovine serum albumin adsorption and zeta potential determination of 
 the ( adsorption ) suspension be carry out . the adsorption 
 isotherm be find to be of typical Langmuir type ; value of the 
 bovine serum albumin adsorption capacity be calculate . 
 increasing of ph lead to decrease of zeta potential and decrease of 
 adsorption capacity of cerium oxide nanoparticle . the maximum 
 adsorption capacity be find for strongly acid suspension ( be = 
 118 mg / g ) . the sample of nanoceria with positive zeta potential 
 adsorb more bovine serum albumin on the other hand , the sample 
 with negative zeta potential show little or no protein adsorption . 
 Surface charge or well say zeta potential of ceo2 nanoparticle 
 play the key role in adsorption of protein on such type of material ."
48,A Study of Removing SUVA and Trihalomethanes by Biological Activated Carbon,10.5281/zenodo.1088362,"Tseng, Wei-Bin., Lou, Jie-Chung, Han, Jia-Yun",2013-09-06,SUVA (equivalent to UV254/DOC) value in raw water is a precursor for the formation of trihalomethane during chlorination at a water treatment plant. This study collected rapidly filtered water from an advanced water treatment plant for use in experiments on raw water. The removal rate of treating the trihalomethanes formation potential (THMFP) was conducted by using a biological activated carbon. The hydraulic retention time and SUVA loading were major factors in biological degradation tests. The results showed that biological powder-activated carbon (BPAC) lowered the average concentration of UV254 and value of SUVA in raw water. A removal efficiency of THMFP was present in the treatment of the three primary organic carbon items. These results highlighted the importance of the BPAC had an excellent treatment efficiency on THMFP.,https://zenodo.org/api/files/8ea6992c-c57d-448d-8ff1-86184662d7cd/17087.pdf,pdf,SUVA ( equivalent to UV254 / DOC ) value in raw water be a precursor for the formation of trihalomethane during chlorination at a water treatment plant . this study collect rapidly filter water from an advanced water treatment plant for use in experiment on raw water . the removal rate of treat the trihalomethane formation potential ( THMFP ) be conduct by use a biological activate carbon . the hydraulic retention time and suva loading be major factor in biological degradation test . the result show that biological powder - activate carbon ( BPAC ) lower the average concentration of UV254 and value of SUVA in raw water . a removal efficiency of THMFP be present in the treatment of the three primary organic carbon item . these result highlight the importance of the BPAC have an excellent treatment efficiency on THMFP .
49,Solar Energy for Water Conditioning,10.5281/zenodo.1061549,"J. Pawłat, H. Stryczewska",2011-10-28,"Shortening of natural resources will impose greater
limitations of electric energy consumption in various fields including
water treatment technologies. Small water treatment installations
supplied with electric energy from solar sources are perfect example of
zero-emission technology. Possibility of solar energy application, as
one of the alternative energy resources for decontamination processes
is strongly dependent on geographical location. Various examples of
solar driven water purification systems are given and design of
solar-water treatment installation based on ozone for the geographical
conditions in Poland are presented.",https://zenodo.org/api/files/d9319e3a-3614-48be-a9b7-48ae0b549d1d/5708.pdf,pdf,"shortening of natural resource will impose great 
 limitation of electric energy consumption in various field include 
 water treatment technology . small water treatment installation 
 supply with electric energy from solar source be perfect example of 
 zero - emission technology . possibility of solar energy application , as 
 one of the alternative energy resource for decontamination process 
 be strongly dependent on geographical location . various example of 
 solar drive water purification system be give and design of 
 solar - water treatment installation base on ozone for the geographical 
 condition in Poland be present ."
50,"Behaviors, Knowledge and Practices of the Population of Ahomadégbé's District (Municipality of Lalo) in Benin in Connection of Home Water Treatment Methods",10.5281/zenodo.5188535,"Roch Christian Johnson, Gratien Boni",2021-05-29,"Water is an indispensable resource for life. In the district of Ahomadégbé in Benin, access of households to improved water sources is not a problem because a large part of the population has water.
However, people consume poor water quality which is a function of microbiological contamination during transport and storage. The objective of this research is to analyze the behavior, knowledge and practices of households relating drinking water treatment methods in the district of Ahomadégbé with a view to proposing adequate measures for improving the quality of drinking water.
As part of this research, the questionnaire was used to approach 377 residents individually and 82 participants were organized into eight focus groups to understand the behavior, knowledge and practices of population.
The results show that more than 65% of the population of the borough have knowledge of certain process of treating water at home.
But they find themselves limited in the application of these different water treatment methods and only 6.1% of the population used at least one home water treatment method, even if this is not always appropriated.
The water treatment methods residents used were Alum (KAl(SO4)2∙12 H2O, chemical decantation method), filtration on tissues, and disinfection by boiling. The populations resort to other techniques of water treatment at home such as the use of oil and cresol which prove ineffective.
The population is aware of water contamination during transport and storage. However, most residents interviewed do not treat water before consumption, and the few who treat it resort to unsuitable methods. Thus, households need to be sensitized on effective and suitable methods of water treatment for their well-being.",Inconnu,Inconnu,"water be an indispensable resource for life . in the district of Ahomadégbé in Benin , access of household to improve water source be not a problem because a large part of the population have water . 
 however , people consume poor water quality which be a function of microbiological contamination during transport and storage . the objective of this research be to analyze the behavior , knowledge and practice of household relate drink water treatment method in the district of Ahomadégbé with a view to propose adequate measure for improve the quality of drinking water . 
 as part of this research , the questionnaire be use to approach 377 resident individually and 82 participant be organize into eight focus group to understand the behavior , knowledge and practice of population . 
 the result show that more than 65 % of the population of the borough have knowledge of certain process of treat water at home . 
 but they find themselves limit in the application of these different water treatment method and only 6.1 % of the population use at least one home water treatment method , even if this be not always appropriate . 
 the water treatment method resident use be Alum ( KAl(SO4)2∙12 H2O , chemical decantation method ) , filtration on tissue , and disinfection by boil . the population resort to other technique of water treatment at home such as the use of oil and cresol which prove ineffective . 
 the population be aware of water contamination during transport and storage . however , most resident interview do not treat water before consumption , and the few who treat it resort to unsuitable method . thus , household need to be sensitize on effective and suitable method of water treatment for their well - being ."
51,"Spectrophotometric Studies on the Complexes of 3-Nitroalizarin with Lanthanum, Cerium, Praseodymium, Neodymium and Samarium",10.5281/zenodo.6476892,"Jamil Ahmad, Naseer Ahmad, S. M. F. Rahman",1967-05-31,"Spectrophotometric Studies on the Complexes of 3-Nitroalizarin with Lanthanum, Cerium, Praseodymium, Neodymium and Samarium.",https://zenodo.org/api/files/3e0bdadb-83ae-40d4-8874-0fe67222ce0f/444-447.pdf,pdf,"Spectrophotometric Studies   on   the complex of 3 - Nitroalizarin with Lanthanum , Cerium , Praseodymium , Neodymium and Samarium ."
52,APPLICATION OF COMPUTATIONAL FLUID DYNAMICS MODELLING TO A HORIZONTAL SEDIMENTATION TANK IN IRAQ,10.5281/zenodo.495142,Ali Hadi GHAWI,2017-04-05,"Computational Fluid Dynamics modeling has been applied to examine the hydrodynamic behavior of water treatment sedimentation tanks at Baghdad Water Works, operated by Alkurech Water in Baghdad in Iraq. The existing tanks perform poorly at current flows and flow is unevenly split among online tanks, Therefore, CFD was used to investigate velocity profiles at current and projected loadings for the existing basins. Results from the CFD analysis were used to develop retrofit strategies to improve velocity profiles , design and operation of sedimentation tanks in the existing basins. The paper shows how CFD can be helpful in order to improve the design of existing water treatment plants and the process efficiency. In this scope, CFD enables designs more reliable and cost effective water treatment process which remain basic environmental policy issues.Computational Fluid Dynamics modeling has been applied to examine the hydrodynamic behavior of water treatment sedimentation tanks at Baghdad Water Works, operated by Alkurech Water in Baghdad in Iraq. The existing tanks perform poorly at current flows and flow is unevenly split among online tanks, Therefore, CFD was used to investigate velocity profiles at current and projected loadings for the existing basins. Results from the CFD analysis were used to develop retrofit strategies to improve velocity profiles , design and operation of sedimentation tanks in the existing basins. The paper shows how CFD can be helpful in order to improve the design of existing water treatment plants and the process efficiency. In this scope, CFD enables designs more reliable and cost effective water treatment process which remain basic environmental policy issues.",https://zenodo.org/api/files/b484bebf-d7ac-4a01-b8a3-60b5f435e76c/ali%20ghawi.docx,docx,"Computational Fluid Dynamics modeling have be apply to examine the hydrodynamic behavior of water treatment sedimentation tank at Baghdad Water Works , operate by Alkurech Water in Baghdad in Iraq . the exist tank perform poorly at current flow and flow be unevenly split among online tank , therefore , CFD be use to investigate velocity profile at current and project loading for the exist basin . result from the CFD analysis be use to develop retrofit strategy to improve velocity profile , design and operation of sedimentation tank in the exist basin . the paper show how CFD can be helpful in order to improve the design of exist water treatment plant and the process efficiency . in this scope , CFD enable design more reliable and cost effective water treatment process which remain basic environmental policy issue . Computational Fluid Dynamics modeling have be apply to examine the hydrodynamic behavior of water treatment sedimentation tank at Baghdad Water Works , operate by Alkurech Water in Baghdad in Iraq . the exist tank perform poorly at current flow and flow be unevenly split among online tank , therefore , CFD be use to investigate velocity profile at current and project loading for the exist basin . result from the CFD analysis be use to develop retrofit strategy to improve velocity profile , design and operation of sedimentation tank in the exist basin . the paper show how CFD can be helpful in order to improve the design of exist water treatment plant and the process efficiency . in this scope , CFD enable design more reliable and cost effective water treatment process which remain basic environmental policy issue ."
